{
  "profile_id": "EP-T91-S1-P2",
  "version": "0.1",
  "task_id": "T91",
  "principal": "provider:org.ainative.provider.table-import",
  "isolation_class": "P2",
  "filesystem": [
    {
      "resource": "artifact:A17",
      "target": "/task/input/source.xlsx",
      "mode": "read-only",
      "required": true
    },
    {
      "resource": "task-output:T91",
      "target": "/task/output",
      "mode": "read-write",
      "required": true
    }
  ],
  "network": {
    "mode": "none",
    "allowed_destinations": []
  },
  "devices": [],
  "limits": {
    "memory_bytes": 536870912,
    "pids_max": 64,
    "cpu_quota_percent": 200,
    "wall_time_seconds": 120
  },
  "kernel_controls": {
    "no_new_privileges": true,
    "user_namespace": true,
    "pid_namespace": true,
    "ipc_namespace": true,
    "mount_namespace": true,
    "seccomp_profile": "table-import-v1",
    "landlock_required": false
  },
  "runtime": {
    "kind": "bubblewrap",
    "image_or_habitat": null,
    "digest": null
  },
  "authority_token_ids": ["CT-T91-S1-001"]
}
